{
  "$schema": "https://json-schema.org/draft/2020-12/schema",
  "$id": "https://our-notes-update-monitor.invalid/schemas/status.schema.json",
  "title": "Our Notes update monitor status",
  "type": "object",
  "required": [
    "healthy",
    "lastSuccessfulScan",
    "currentSnapshot",
    "latestEvent",
    "catalogVersionSource",
    "gameVersionAvailable",
    "masterAuthority"
  ],
  "properties": {
    "healthy": {"type": "boolean"},
    "lastProbe": {"type": ["string", "null"], "format": "date-time"},
    "lastSuccessfulScan": {"type": ["string", "null"], "format": "date-time"},
    "currentSnapshot": {"type": ["string", "null"]},
    "latestEvent": {"type": ["string", "null"]},
    "catalogVersionSource": {"enum": ["config", "probe", "official-endpoint", "master-anchor", "master-anchor+probe"]},
    "catalogVersionConfiguredFloor": {"type": ["string", "null"]},
    "catalogVersionResolved": {"type": ["string", "null"]},
    "gameVersionAvailable": {"type": "boolean"},
    "masterAuthority": {"enum": ["official", "derived", "unavailable"]},
    "masterVersion": {"type": ["string", "null"]},
    "masterResourceVersion": {"type": ["string", "null"]},
    "masterManifestSha256": {"type": ["string", "null"], "pattern": "^[a-f0-9]{64}$"},
    "source": {"type": "object"}
  },
  "additionalProperties": true
}
