{
  "catalogVersionConfiguredFloor": "1.0.0.201",
  "catalogVersionResolved": "1.0.0.400",
  "catalogVersionSource": "master-anchor+probe",
  "currentSnapshot": "intl-52407e2a19eead40",
  "gameVersionAvailable": false,
  "healthy": true,
  "lastProbe": "2026-10-09T17:09:20Z",
  "lastSuccessfulScan": "2026-10-09T17:09:20Z",
  "latestEvent": "intl-d3897d3f2672dadf",
  "masterAuthority": "official",
  "masterManifestSha256": "47dd16a3f8fbee2e3b17a4ef0e360dfd7f39bef87bfef6a30df3ff886bee36db",
  "masterResourceVersion": "1.0.0.400",
  "masterVersion": "b64b05ec9d46e8fc36b061db7e843624",
  "source": {
    "catalog": "ok",
    "gameVersion": "unavailable",
    "master": "ok"
  }
}
